{
  "observer_contract": 2,
  "request_id": "11111111-1111-4111-8111-111111111111",
  "subscription_id": "22222222-2222-4222-8222-222222222222",
  "profile": "default",
  "session_key": "session-root-1",
  "target_source": "cloud_authorized_binding",
  "reason": "client_unsubscribe",
  "closed_at": "2026-08-01T00:00:01Z"
}
